{
  "schema_version": "0.17",
  "project_id": "fermentation_hangzhou_2026",
  "mode": "hero_rough",
  "brief": {
    "confirmed": true,
    "title": "美味发酵节",
    "date": "2026.10.14—10.18",
    "venue": "杭州天目里",
    "core_experience": "发酵中的时间与食物变化"
  },
  "canvas": {
    "width": 1080,
    "height": 1350
  },
  "backend": {
    "id": "local-imagegen",
    "supports_reference_images": false,
    "supports_external_lora": false,
    "supports_negative_prompt": false
  },
  "feedback": {
    "project_id": "fermentation_hangzhou_2026",
    "rejected": true,
    "previous_route": {
      "lead_id": "P03",
      "palette_family": "cyan_red_warm_cream",
      "type_family": "ZCOOL KuaiLe",
      "concept_id": "giant_single_jar_blob",
      "background_family": "distressed_warm_paper"
    },
    "must_change": [
      "palette_family",
      "type_family",
      "concept_id",
      "background_family"
    ],
    "disliked_appearances": [
      "muddy beige ground",
      "red and cyan",
      "ugly angular Chinese H0",
      "giant featureless jar"
    ]
  },
  "routes": [
    {
      "id": "alternative_1",
      "lead": {
        "id": "P09",
        "path": "style_packs/S01_PLAYFUL_DOODLE/references/positive/P09.jpg",
        "observed": true,
        "observation_note": "实际观察：large simplified outline and loose pastel-flat color accents; one dominant image mass under loose black heading",
        "palette_family": "black_blue_pink",
        "value_regime": "high_key",
        "medium": "large simplified outline and loose pastel-flat color accents",
        "type_dna": "brushy informal lettering with a black strong headline",
        "structure": "one dominant image mass under loose black heading",
        "classification": "STRONG_LEAD"
      },
      "color": {
        "palette_family": "black_blue_pink",
        "background_family": "fresh_white",
        "source": "lead",
        "background": "fresh bright paper-white, absolutely no grunge",
        "dominant": "black with restrained powder-blue",
        "secondary": "muted pale accents only"
      },
      "typography": {
        "type_family": "custom_black_ink_letterforms",
        "strategy": "verified_custom_artword",
        "h0_design_action": "actual Chinese glyph contours with intentionally drawn and verified line rhythms, not CSS rotation",
        "reference_reason": "title and image meet by thickness-and-silhouette relationships"
      },
      "concept": {
        "id": "ferment_time_path",
        "hero_subject": "one atypically cropped fermentation-process glyph",
        "visible_mechanism": "time stages transform a linear symbol into a food texture that alters the page negative-space boundary",
        "theme_binding": "food fermentation changes material over several days, depicted as changing contour"
      },
      "composition": {
        "hero_zone": "right two thirds rising across midheight",
        "h0_zone": "upper left as real glyph-safe artword",
        "info_zone": "bottom clean zone",
        "negative_space": "intentional crescent gap around hero shape"
      },
      "reference_fit_reason": "The current lead has compatible page structure for a large transformation silhouette and type with enough space.",
      "negative_constraints": [
        "no cyan-red-yellowed paper combination",
        "no single unbroken giant jar blob",
        "no pasted fake Chinese text",
        "no generic children sticker illustration"
      ]
    },
    {
      "id": "alternative_2",
      "lead": {
        "id": "P05",
        "path": "style_packs/S01_PLAYFUL_DOODLE/references/positive/P05.jpg",
        "observed": true,
        "observation_note": "实际观察：black delicate freehand ink drawing with restrained spot colors; type concentrated top, narrative drawings in open center, compact small information below",
        "palette_family": "black_white_spot",
        "value_regime": "high_key",
        "medium": "black delicate freehand ink drawing with restrained spot colors",
        "type_dna": "high contrast clean narrow black Chinese typography, editorially arranged",
        "structure": "type concentrated top, narrative drawings in open center, compact small information below",
        "classification": "STRONG_LEAD"
      },
      "color": {
        "palette_family": "black_white_spot",
        "background_family": "fresh_white",
        "source": "lead",
        "background": "fresh bright paper-white, absolutely no grunge",
        "dominant": "ink-black",
        "secondary": "muted pale accents only"
      },
      "typography": {
        "type_family": "fine_black_custom_title",
        "strategy": "verified_custom_artword",
        "h0_design_action": "actual Chinese glyph contours with intentionally drawn and verified line rhythms, not CSS rotation",
        "reference_reason": "title and image meet by thickness-and-silhouette relationships"
      },
      "concept": {
        "id": "culture_growth_grid",
        "hero_subject": "one atypically cropped fermentation-process glyph",
        "visible_mechanism": "time stages transform a linear symbol into a food texture that alters the page negative-space boundary",
        "theme_binding": "food fermentation changes material over several days, depicted as changing contour"
      },
      "composition": {
        "hero_zone": "right two thirds rising across midheight",
        "h0_zone": "upper left as real glyph-safe artword",
        "info_zone": "bottom clean zone",
        "negative_space": "intentional crescent gap around hero shape"
      },
      "reference_fit_reason": "The current lead has compatible page structure for a large transformation silhouette and type with enough space.",
      "negative_constraints": [
        "no cyan-red-yellowed paper combination",
        "no single unbroken giant jar blob",
        "no pasted fake Chinese text",
        "no generic children sticker illustration"
      ]
    }
  ]
}